Armor Vienna Sausage,54100794130
Food Lion Green Beans No Salt,35826098948
Publix Green Beans No Salt,41415086418
Early Garden Mixed Green Beans No Salt,24000222040
Great Value Cut Green Beans No Salt,78742369433
Laura Lynn Green Beans No Salt,86854014172
Food Lion Sliced Beets No Salt,35826206381
Del Monte Swee Peas No Salt,24000163077
Laura Lynn Sweet Peas No Salt,86854042335
Green Giant Sweet Peas,8.10154E+11
del Monte Swee Peas No Salt,8.10037E+11
Diced Tomatoes with gralic and onions,41415075412
Mixed Vegetables Verduras Mixtas,33828080121
Stokely's Traditional Vegetables No Salt Added,70222039584
Tomatoes Tomato Paste,20733384
Campbell Vegetarian Vegetable Soup,51000273499
Campbell Vegetable Beef Soup,51000224736
Progresso Homestyle Chicken Soup,41196123630
Food Lion Beef with Vegetables Soup,35826200419
Lentil Vegetable Soup,4.0991E+12
Hearty Chicken and Dumplings Soup,20734930
Chicken Noodle Condensed Soup,20734992
Stewed Tomatoes Original,4.05649E+12
Tomato Condensed Soup,86854005927
Chef's Cupboard Tomato Condensed Soup,4.0991E+12
Great Value Tomato Soup,78742371573
Publix Tomato Sauce,41415009417
Happy Harvest Tomato,4.0991E+12
Member's Mark Diced Tomatos in Juice,1.93968E+11
Del Monte Sweet Corn Cream Style ,24000163015
Cha-Ching Corn Whole Kernel,7.25439E+11
Pregresso Lentil,41196010220
Lidl Whole Berry Cranberry Sauce,4.05649E+12
Food Lion Tomato Sauce No Salt,35826108470
Northern Catch Chunk Light Tuna,4.06146E+12
Great Value  Chunk Light Tuna in Water,78742082752
Lidl Sweet Peas,4.05649E+12
Laura Lynn Chicken and Stars Condensed Soup,86854051405
Mission Pride Applesauce,73934153456
Brookdale Premium Chunk Chicken Breast ,4.0991E+12
Swanson White Premium Chicken Breast ,51000023797
Lidl Traditional Chicken Flavored Gravy ,20748890
Crider Chunk White Chicken ,19722163207
Great Value Chunk Chicken Breast 5oz,78742001012
Laura Lynn Chunk Chicken Breast,86854009475
Great Value Deluxe Baked Mashed Potatoes,78742069845
Cup Noodles Chicken Flavor,70662030035
Lidl Chunk Light Tuna Pouch,4.33562E+12
Great Value Ranch Chunk Light Tuna,78742128344
Campbell's Chicken Noodle Soup less sodium,51000281081
Great Value Chunk Chicken Breast 12.5 oz,78742067841
Great Value Cornbread Stuffing Mix,78742433721
Clover Valley Chunk Light Tuna,7.75172E+12
Northern Catch Solid White Tuna ,4.0991E+12
Chicken of the Sea Alaskan Pink Salmon,48000000866
Lidl Skipjack Chunk Tuna,4.05649E+12
Kirkland Albacore Solid White Tuna,96619977819
Publix Tomato Paste 6oz,41415007413
American Beauty Tomato,7.15001E+11
Laura Lynn Chicken Noodle Soup 18.6oz,86854043196
Nissin Top Ramen Chicken Flavor,70662010037
Maruchan Ramen Noodle Soup Chicken ,41789002113
Maruchan Ramen Noodle Soup Beef,41789002120
Lakeside Sliced Carrots,33828040125
Campbell's Chicken Noodle Soup 10.75oz,51000012517
Campbell's Chicken Noodle Soup 13.8oz,51000224675
Marie Callender's Chicken & Dumplings Soup,50100405755
Publix Macaroni & Cheese Box,41415016231
American Beauty Vegetable Soup,7.15001E+11
Happy Harvest Whole Kernel Sweet Corn,4.0991E+12
Lidl Whole Kernel Sweet Corn,4.05649E+12
Lakeside Foods Whole Kernel Corn,33828078128
Happy Harvest Sweet Corn,4.0991E+12
Great Value Whole Cream Style Sweet Corn ,78742094212
Great Value Golden Sweet Corn ,78742369396
Lidle Cream Style Sweet Corn ,4.05649E+12
Food Lion Crisp Sweet Corn No Salt Added,35826098962
Campbell's Simply Chicken Noodle,51000283153
Barilla Thin Spaghetti 1lb,76808280098
Combino Spaghetti 1lb,4.05649E+12
Mueller's Thin Spaghetti 1lb,29200002140
Garolalo Organic Spaghetti 17.6oz,21511137153
Lidl Pork and Beans,4.05649E+12
Iberia Green Pigeon Peas ,75669102808
Goya Green Pigeon Peas ,41331120012
Mothers Maid Black Beans,42396253912
Dakota's Pride Black Beans,4.0991E+12
Publix Black Beans,41415107410
Van Camp's Pork and Beans,52000011227
Dakota's Pride Pork and Beans,4.0991E+12
American Beauty Black Beans,7.15001E+11
Publix Pork and Beans,41415037410
Lidl Seasoned Black Beans,4.05649E+12
Bush's Organic Black Beans,39400018780
La Moderna Macaroni 7oz,29243000240
Lidl Brown Gravy Mix,20749644
Lidl Stuffing Mix for Turkey ,4.05649E+12
Lidle Stuffing Mix for Chicken,4.05649E+12
Campbell's Cream of Mushroom 22.6oz,51000212443
Lidl Cream of Chicken Condensed Soup,20735050
Chef's Cupboard Cream of Chicken ,4.0991E+12
Campbell's Cream of Chicken 10.5oz,51000115539
Lidl Traditional Roasted Turkey Gravy,20748913
Publix Cream of Mushroom 10.5oz,41415001374
Great Value Black Eyed Peas,6.05388E+11
Velveeta Shell's and Cheese Single Cup,21000023226
Margaret Holmes Fancy Spinach,41443102418
Lidl Cream of Mushroom Condensed Soup,20988890
Great Value Cream of Mushroom,78742371603
Lidl Garlic Powder,20000349
American Beauty Garbanzo Beans Chickpeas,7.15001E+11
Great Value Sliced Carrots,78742434230
Great Value Cut Green Beans,78742369440
IGA Green Beans Cut,41270874168
Laura Lynn Green Beans,86854014165
Great Value French Style Green Beans,78742076409
Happy Harvest Green Beans,4.0991E+12
Lidl Blackeye Peas,4.05649E+12
Happy Harvest Cut Green Beans,4.0991E+12
Laura Lynn Blackeye Peas,86854005422
Great Value Black Eyed Peas,6.05388E+11
Del Monte Whole Green Beans,24000162933
Dakota's Pride Blackeye Peas,4.0991E+12
Hanover Blackeye Peas,28800158011
Food Lion Sliced Carrots,35826029362
Happy Harvest French Style Green Beans,4.0991E+12
Lidle Sliced Carrots ,20866938
Lidl Green Lima Beans,4.05649E+12
Founders Sliced Carrots,1.95465E+11
Lidl Garbanzo Beans Chick Peas,4.05649E+12
Great Value Garbanzo Chick Peas,78742099897
Lakeside Cut Green Beans,33828220121
Happy Harvest Sliced Carrots,4.0991E+12
Bush's Blackeye Peas,39400013686
Colgate MaxFresh Cool Mint Toothpaste,35000996671
Colgate Total Clean Mint Toothpaste,35000459862
Crest 3D White Mint Toothpaste,30772103135
Garden Veggie Straws Sea Salt,8.29515E+11
Baked Cheetos Cheese,28400039796
Garden Veggie Straws Cheddar Cheese,8.29515E+11
Garden Veggie Straws Zesty Ranch,8.29515E+11
Lay's Baked Orginial Potato Chips,28400071888
Teddy Grahams Honey,44000020361
Nutter Butter Bites,44000020187
Cheeze-It Original ,24100122615
Pirate's Booty Aged White Cheddar,15665624058
Lance Toast Chee Cheddar Cheese,76410903873
Lance Toast Chee Peanut Butter,76410901633
Nature Valley Crispy Wafer Peanut Butter Chocolate,16000272880
Nature Valley Crispy Wafer Peanut,16000442825
Quaker Chewy Peanut Butter Chocolate Chip Granola Bars,3077601
Kirkland Mini Muffins Chocolate Chip,1.96634E+11
